{
  "$schema": "https://json-schema.org/draft/2020-12/schema",
  "$id": "https://github.com/Malmo-Skyttegille-Pistolsektionen/rotation_target/contracts/program.schema.json",
  "title": "Program",
  "description": "A rotation target program document, as stored in resources/programs/files/<id>.json and as returned by GET /api/v2/programs/{id}. Canonical: written from firmware/lib/rt_logic/program.cpp. Three fields are not the uploader's to assert. `id` is ignored on upload (the device assigns the next free id from 100) and, for a shipped program, comes from the filename rather than the document. `readonly` follows from the directory the file was loaded from - shipped programs are read-only, uploaded ones are not - and is overwritten on parse. Unknown fields are ignored by the firmware and dropped when it rewrites the document, so a program uploaded with extra keys does not come back with them; this schema rejects them outright instead, to catch typos while authoring. The webapp does not use this schema at runtime: webapp/src/lib/program-document.ts checks an uploaded file against what firmware/lib/rt_logic/program.cpp actually does, and its header lists where the two deliberately differ.",
  "type": "object",
  "additionalProperties": false,
  "required": [
    "id",
    "title",
    "description",
    "readonly",
    "series"
  ],
  "properties": {
    "id": {
      "type": "integer",
      "description": "Ignored on upload; assigned by the device from 100 upwards. For a shipped program the filename is the authority."
    },
    "title": {
      "type": "string"
    },
    "description": {
      "type": "string"
    },
    "readonly": {
      "type": "boolean",
      "description": "Imposed by the device from where the file came, not read from the document. True for programs flashed with the firmware; only non-read-only programs can be deleted."
    },
    "series": {
      "type": "array",
      "items": {
        "$ref": "#/$defs/Series"
      }
    }
  },
  "$defs": {
    "Series": {
      "type": "object",
      "additionalProperties": false,
      "required": [
        "name",
        "optional",
        "events"
      ],
      "properties": {
        "name": {
          "type": "string"
        },
        "optional": {
          "type": "boolean",
          "default": false,
          "description": "Carried through the API but not acted on by the run loop: the executor runs one series at a time and never skips one by itself."
        },
        "events": {
          "type": "array",
          "items": {
            "$ref": "#/$defs/Event"
          }
        },
        "timer_start_index": {
          "type": "integer",
          "minimum": 0,
          "default": 0,
          "description": "Index into this series' `events` of the event where the run timer reaches zero. Everything before it is preamble - the audio announcing the series, the count, the loading period - and should not be counted as shooting time. `stateUpdate.tickerMs` is measured relative to the start of this event: negative while counting down to it, zero as it begins, positive after. Defaults to 0, which makes the ticker identical to elapsed-since-series-start, so a program without this field behaves exactly as before. Must be a valid index into `events`."
        }
      }
    },
    "Event": {
      "type": "object",
      "additionalProperties": false,
      "required": [
        "duration"
      ],
      "properties": {
        "duration": {
          "type": "integer",
          "description": "Duration of the event in milliseconds. For example: 1000 = 1.0s, 5000 = 5.0s, 60000 = 60s. Clamped to 1..3600000 on parse: a 0 or negative value becomes 1 ms (a zero-length event would never be entered, silently skipping its command and audio) and anything larger is capped, so a series total cannot overflow.",
          "minimum": 0
        },
        "command": {
          "type": "string",
          "description": "What to do with the targets on entering this event. Optional: omit it for a timed pause that leaves the targets where they are. When present it must be \"show\" or \"hide\" - the firmware refuses the whole program otherwise, so a typo fails at upload rather than becoming a target that silently never turns. The firmware additionally accepts null and \"\" on upload as spellings of omission (the legacy editor writes null); it never writes either, so no stored file carries them and this schema does not allow them.",
          "enum": [
            "show",
            "hide"
          ]
        },
        "banks": {
          "type": "object",
          "description": "Per-bank overrides of `command`, keyed by bank letter. On entering the event `command` applies to every bank not named here, `banks` sets the ones it does name, and a bank named by neither is left where it is. Omitted or `{}` mean no overrides, so a program without this field is unchanged - `{\"command\": \"show\"}` still turns every bank. The firmware additionally accepts `null` on upload as a spelling of omission, the way it does for `command`; it never writes one, so no stored file carries it and this schema does not allow it. A letter the device does not have is refused at start (`/problems/program_banks_unavailable`, 409), never at upload: the library is a library, and the same file runs on the device next door that has the bank.",
          "propertyNames": {
            "pattern": "^[A-H]$"
          },
          "additionalProperties": {
            "type": "string",
            "enum": [
              "show",
              "hide"
            ]
          }
        },
        "audio_ids": {
          "type": "array",
          "items": {
            "type": "integer"
          },
          "description": "List of audio IDs to start on entering this event. Ids that no longer exist are skipped."
        },
        "target_system": {
          "type": "array",
          "items": {
            "type": "integer"
          },
          "description": "API v1 only. List of target system IDs associated with the event; if not specified, all target systems are affected. The v2 firmware does not parse this field and drops it when it rewrites an uploaded document. Kept here so v1-era program files still validate."
        },
        "start": {
          "type": "boolean",
          "description": "API v1 only. Marked this event as the starting event in the series. The v2 firmware does not parse this field and drops it when it rewrites an uploaded document. Kept here so v1-era program files still validate."
        }
      }
    }
  }
}
